sujet,date,statut
Quelle technique de perspective cavalière les miniaturistes persans utilisaient-ils pour les scènes de chasse ?,2025-10-15T15:00:12.357222,succès
Pourquoi les oiseaux exotiques deviennent-ils si populaires dans la peinture flamande après 1500 ?,2025-10-17T09:37:06.054651,succès
Comment les artistes du Fayoum représentaient-ils les animaux de compagnie dans les portraits funéraires ?,2025-10-21T09:39:23.726364,succès
Quelle est la signification des animaux en vis-à-vis dans les tapis arméniens médiévaux ?,2025-10-24T09:38:41.660442,succès
Les animaux dans l'art préislamique de Palmyre : syncrétisme gréco-oriental ou tradition locale ?,2025-10-28T07:34:56.588144,succès
